{
  "schema_version": 2,
  "ready": true,
  "id": "MT-TS-2026-10-05-ai-abundance-infrastructure-concentration",
  "slug": "2026-10-05-technology-signal-ai-abundance-infrastructure-concentration",
  "date": "2026-10-05",
  "published_at": "2026-10-05T09:32:00-03:00",
  "kind": "weekly-technology-signal",
  "priority": 32,
  "source_locale": "en",
  "sources": {
    "en": {
      "markdown": "staging/research/2026/10/2026-10-05-technology-signal-ai-abundance-infrastructure-concentration/en.md",
      "title": "AI is making software and cognitive work more abundant — while concentrating the infrastructure that produces them",
      "deck": "Falling task and application costs are compressing entry-level work and generic software rents while compute, energy, data, distribution and trusted workflows become scarcer and more strategic.",
      "tags": [
        "AI",
        "labor markets",
        "SaaS",
        "cloud",
        "technology concentration",
        "energy"
      ],
      "keywords": [
        "AI acceleration",
        "AI labor market",
        "SaaS valuations",
        "cloud concentration",
        "AI infrastructure",
        "outcome pricing",
        "entry-level jobs",
        "Peter Thiel",
        "data centers",
        "software economics"
      ],
      "regime": "AI is lowering the cost of digital production faster than the physical and institutional inputs required to deploy it at scale.",
      "key_risk": "Productivity gains may coexist with weaker entry-level career ladders and a larger share of economic rents accruing to infrastructure, distribution and capital owners.",
      "watch": [
        "young-worker hiring in exposed occupations",
        "SaaS revenue multiples and pricing models",
        "hyperscaler capex and data-centre returns",
        "cloud switching costs and concentration",
        "data-centre electricity and grid queues",
        "independent workflow productivity studies"
      ],
      "search_text": "AI acceleration labor employment junior jobs SaaS software valuations cloud monopoly concentration compute energy data centers outcome pricing Peter Thiel Sequoia Bessemer SoftBank"
    },
    "pt-BR": {
      "markdown": "staging/research/2026/10/2026-10-05-technology-signal-ai-abundance-infrastructure-concentration/pt-BR.md",
      "title": "A IA está tornando software e trabalho cognitivo mais abundantes — e a infraestrutura que os produz mais concentrada",
      "deck": "A queda do custo de tarefas e aplicações pressiona trabalho de entrada e rendas de software genérico enquanto compute, energia, dados, distribuição e workflows confiáveis se tornam mais escassos e estratégicos.",
      "tags": [
        "IA",
        "mercado de trabalho",
        "SaaS",
        "cloud",
        "concentração tecnológica",
        "energia"
      ],
      "keywords": [
        "aceleração da IA",
        "mercado de trabalho IA",
        "valuações SaaS",
        "concentração cloud",
        "infraestrutura de IA",
        "outcome pricing",
        "empregos de entrada",
        "Peter Thiel",
        "data centers",
        "economia do software"
      ],
      "regime": "A IA reduz o custo da produção digital mais rápido do que os insumos físicos e institucionais necessários para implantá-la em escala.",
      "key_risk": "Ganhos de produtividade podem coexistir com escadas de carreira mais estreitas e maior parcela das rendas econômicas apropriada por donos de infraestrutura, distribuição e capital.",
      "watch": [
        "contratação de jovens em ocupações expostas",
        "múltiplos e modelos de preço do SaaS",
        "capex de hyperscalers e retorno de data centers",
        "custos de troca e concentração em cloud",
        "eletricidade de data centers e filas de rede",
        "estudos independentes de produtividade em workflows"
      ],
      "search_text": "aceleração IA trabalho emprego vagas júnior SaaS software valuations cloud monopólio concentração compute energia data centers precificação por resultado Peter Thiel Sequoia Bessemer SoftBank"
    }
  },
  "taxonomy_version": "1.0",
  "program": "technology-production-society",
  "related_programs": [
    "political-economy-markets",
    "global-system-power"
  ],
  "dimensions": [
    "economy",
    "politics",
    "society"
  ],
  "geography": {
    "level": "global",
    "regions": [],
    "subregions": [],
    "countries": []
  },
  "topics": [
    "technology-innovation",
    "industry-production",
    "capital-markets",
    "demography-labor",
    "inequality-distribution",
    "institutions-governance",
    "energy",
    "infrastructure-logistics",
    "social-change"
  ],
  "phenomena": [
    "institutional-change",
    "social-change",
    "strategic-competition"
  ],
  "format": "assessment",
  "cadence": "weekly",
  "signal_rationale": {
    "delta": "By October 2026, evidence from labour markets, software valuations, pricing models, cloud regulation and energy infrastructure can be connected into one observable shift: AI is reducing the scarcity of some cognitive tasks and application features while raising the strategic scarcity of compute, power, capital, distribution and trusted workflows.",
    "evidence": "The assessment triangulates Stanford labour and investment data, ILO and OECD occupational exposure, NBER and METR productivity evidence, SEG and Stripe software-market data, Salesforce pricing, IEA physical-infrastructure data, FTC and European Commission competition work, Microsoft filings and clearly labelled investor theses.",
    "scale_path": "Further diffusion depends on lower model and inference costs, reliable agentic workflows and organizational redesign; concentration depends on whether chips, electricity, grid access, cloud, proprietary data and distribution remain scale-constrained.",
    "transmission": "The shift transmits through entry-level hiring, apprenticeship structures, software pricing and valuation, capital allocation, electricity systems, cloud dependence, bargaining power and international distribution of technology rents.",
    "falsifier": "The thesis weakens if exposed young-worker hiring recovers while AI adoption rises, seat-based software pricing remains dominant in agentic workflows, generic application margins retain durable premiums, and cloud/compute/energy bottlenecks and concentration fall materially."
  },
  "technology_maturity": "deployed-with-uneven-economic-and-social-transmission",
  "assessment_confidence": "high-on-current-investment-labour-software-and-infrastructure-signals-medium-on-2026-2030-distributional-outcomes",
  "key_constraints": [
    "independent productivity measurement",
    "junior skill formation",
    "compute and HBM supply",
    "electricity and grid connections",
    "cloud switching costs",
    "trusted workflow integration",
    "distribution of productivity gains"
  ]
}
